{
  "$schema": "https://json-schema.org/draft/2020-12/schema",
  "$id": "https://github.com/forenly-ai-systems/uipath-maestro-ecm/blob/main/samples/artifacts/engineering_change_request.schema.json",
  "title": "EngineeringChangeRequest",
  "description": "An ECR is created when an IncidentReport matures into a change (IRB disposition 'update as ECR'). It carries the change through Change Analysis: the Risk Agent sets the track, and the boards (TRB technical / CRB business) decide. The business decision is made on cost, person-hour, lead time, and effectivity. An approved ECR evolves into an EngineeringChangeNotice (ECN).",
  "type": "object",
  "required": ["ecrId", "incidentId", "createdAt", "title", "status"],
  "additionalProperties": false,
  "properties": {
    "ecrId": {
      "type": "string",
      "description": "Stable identifier. Format: `ECR-{YYYYMMDD}-{seq}`.",
      "pattern": "^ECR-[0-9]{8}-[0-9]{4,}$",
      "examples": ["ECR-20260520-0001"]
    },
    "incidentId": {
      "type": "string",
      "description": "The IncidentReport this ECR matured from (IRB disposition 'update as ECR').",
      "pattern": "^IR-[0-9]{8}-[0-9]{4,}$"
    },
    "createdAt": {
      "type": "string",
      "format": "date-time",
      "description": "ISO-8601 UTC timestamp the ECR was opened."
    },
    "title": {
      "type": "string",
      "minLength": 3,
      "maxLength": 200,
      "description": "Short headline for the requested change."
    },
    "description": {
      "type": "string",
      "description": "What the change is and why, carried forward from the incident root-cause analysis."
    },
    "requestedBy": {
      "type": "object",
      "description": "The principal that owns the ECR (typically the Change Specialist).",
      "required": ["principalType", "principalId"],
      "additionalProperties": false,
      "properties": {
        "principalType": { "type": "string", "enum": ["human", "service-account", "agent"] },
        "principalId": { "type": "string" },
        "displayName": { "type": "string" }
      }
    },
    "affectedItems": {
      "type": "array",
      "description": "Configuration items / BOM lines implicated by the change. Drives supplier impact analysis.",
      "items": {
        "type": "object",
        "required": ["itemId", "itemType"],
        "additionalProperties": false,
        "properties": {
          "itemId": { "type": "string", "examples": ["PNL-A12-Rev-D"] },
          "itemType": { "type": "string", "enum": ["part", "assembly", "bom-line", "configuration-item"] },
          "supplierId": { "type": "string", "examples": ["sup-acme-001"] },
          "quantity": { "type": "number", "minimum": 0 }
        }
      }
    },
    "complianceClass": {
      "type": "string",
      "enum": ["none", "as9100", "iso10007", "iso13485", "gmp", "iatf-16949", "other"],
      "description": "Regulated-industry compliance class; biases the Risk Agent toward Full Track."
    },
    "disposition": {
      "type": "string",
      "enum": ["scrap", "rework", "use-as-is"],
      "description": "CM change-disposition of the pre-change product (severity classification)."
    },
    "track": {
      "type": "string",
      "enum": ["fast", "full", "undecided"],
      "default": "undecided",
      "description": "Fast Track bypasses the CRB (Change Specialist / Risk Agent decision); Full Track carries a business decision and goes to CRB then CIB."
    },
    "riskScore": {
      "type": "number",
      "minimum": 0,
      "maximum": 1,
      "description": "Risk Agent composite score driving the Fast/Full Track gateway."
    },
    "businessImpact": {
      "type": "object",
      "description": "The four CRB decision dimensions (Change Analysis / Supplier Business Analysis).",
      "additionalProperties": false,
      "properties": {
        "costEstimate": { "type": "number", "minimum": 0, "description": "Estimated cost impact (currency-agnostic)." },
        "personHours": { "type": "number", "minimum": 0, "description": "Estimated person-hour effort." },
        "leadTimeDays": { "type": "number", "minimum": 0, "description": "Estimated lead-time impact in days." },
        "effectivity": { "type": "string", "format": "date", "description": "Planned date the change takes effect." }
      }
    },
    "boardDecisions": {
      "type": "array",
      "description": "Decisions recorded as the ECR passes the boards (TRB technical, CRB business). HITL via Action Center.",
      "items": {
        "type": "object",
        "required": ["board", "decision", "decidedAt"],
        "additionalProperties": false,
        "properties": {
          "board": { "type": "string", "enum": ["IRB", "TRB", "CRB", "CIB"] },
          "decision": {
            "type": "string",
            "enum": ["closed", "updated", "approved", "rejected", "feedback-for-change"],
            "description": "TRB: closed/updated. CRB (supplier business analysis): approved/rejected/feedback-for-change."
          },
          "decidedAt": { "type": "string", "format": "date-time" },
          "decidedBy": { "type": "string" },
          "rationale": { "type": "string", "maxLength": 1000 },
          "aiAssisted": { "type": "boolean", "description": "True if an AI briefing pack pre-rendered this decision." }
        }
      }
    },
    "status": {
      "type": "string",
      "enum": ["open", "under-review", "fast-tracked", "approved", "rejected", "updated", "closed", "evolved-to-ecn"],
      "description": "Lifecycle status of the ECR."
    },
    "ecnId": {
      "type": "string",
      "description": "Set once the ECR evolves into an ECN.",
      "pattern": "^ECN-[0-9]{8}-[0-9]{4,}$"
    },
    "vendor": {
      "type": "object",
      "description": "Source-system-specific payload, preserved for audit.",
      "additionalProperties": true
    }
  }
}
