{
  "ecrId": "ECR-20260520-0001",
  "incidentId": "IR-20260520-0001",
  "createdAt": "2026-05-20T09:02:11Z",
  "title": "Re-route cable on panel A-12 to restore T7-T8-T9 path",
  "description": "Root cause of the AOI-flagged wiring deviation: upper-bus shortcut bypasses terminal T8. ECR to correct the routing on PNL-A12-Rev-D and the affected wire harness.",
  "requestedBy": {
    "principalType": "agent",
    "principalId": "analyst-agent",
    "displayName": "Analyst Agent"
  },
  "affectedItems": [
    { "itemId": "PNL-A12-Rev-D", "itemType": "assembly", "supplierId": "sup-acme-001", "quantity": 1 },
    { "itemId": "WHN-A12-cable-7", "itemType": "part", "supplierId": "sup-acme-001", "quantity": 1 }
  ],
  "complianceClass": "as9100",
  "disposition": "rework",
  "track": "full",
  "riskScore": 0.82,
  "businessImpact": {
    "costEstimate": 4200,
    "personHours": 36,
    "leadTimeDays": 9,
    "effectivity": "2026-06-15"
  },
  "boardDecisions": [
    { "board": "IRB", "decision": "updated", "decidedAt": "2026-05-20T08:40:00Z", "decidedBy": "irb-reviewer-1", "rationale": "Incident matured into an engineering change.", "aiAssisted": true },
    { "board": "TRB", "decision": "updated", "decidedAt": "2026-05-20T10:15:00Z", "decidedBy": "trb-reviewer-2", "rationale": "Technical fix confirmed; ECR updated with routing solution." },
    { "board": "CRB", "decision": "approved", "decidedAt": "2026-05-20T14:30:00Z", "decidedBy": "crb-chair", "rationale": "Cost/lead-time acceptable; AS9100 item, full track justified.", "aiAssisted": true }
  ],
  "status": "evolved-to-ecn",
  "ecnId": "ECN-20260521-0001"
}
